{
  "$schema": "./schemas/meta.schema.json",
  "version": 1,
  "workspaces": [
    {
      "id": "general",
      "name": "General",
      "description": "Default project workspace",
      "commits": [],
      "status": "active"
    },
    {
      "id": "fix-stage-toggle",
      "name": "Fix stage toggle",
      "description": "Fixing the bug that caused the files to switch stages.",
      "commits": [
        "c0cf211bc190185121636d33a684197418293896"
      ],
      "status": "active"
    },
    {
      "id": "fix-generate-schema",
      "name": "Fix generate schema",
      "description": "Schemas not generated",
      "commits": [],
      "status": "active"
    }
  ],
  "tags": {
    "c0cf211bc190185121636d33a684197418293896": [
      "fix"
    ]
  },
  "active_workspace": "fix-generate-schema",
  "impacts": {
    "c0cf211bc190185121636d33a684197418293896": "minor"
  }
}